verb,sentence,human_label,cluster_label
cool,"The sell-off cooled inflation fears , but farm futures prices are now expected to be volatile .",metaphorical,N
cool,"If the story has cooled , it is because Speaker Wright and the Democratic caucus pulled the plug at the right moment .",metaphorical,N
cool,"The Tokyo Stock Exchange has twice this year raised margin requirements in an effort to cool the Tokyo market 's sharp rally , but share prices have continued upward as the moves were widely viewed as , if anything , healthy and reassuring .",metaphorical,N
cool,"Pakistan has served as a conduit for U.S. aid to Afghan rebels , but the settlement may cause its relations with Washington to cool .",metaphorical,N
cool,"Tighter credit could help narrow the trade deficit by cooling consumer spending , but high interest rates have bleaker implications for other areas , such as housing .",metaphorical,N
cool,The result: Some car makers are cooling their hot rods .,metaphorical,N
cool,A Wall Street Journal story yesterday said sales of the company 's clot-dissolving drug TPA have cooled a bit from the fast pace in December .,metaphorical,N
cool,"The United Kingdom 's chancellor of the exchequer , Nigel Lawson , said the country has tightened its monetary policy to cool a consumer spending spree and bolster weak savings and investment levels .",metaphorical,N
cool,The stock-market crash had little cooling effect on one of the world 's hottest property markets .,metaphorical,N
cool,There is suspicion in U.S. industry and government that the latest effort is a political exercise to cool American complaints about subsidies and avert a trade war .,metaphorical,N
cool,"If it cools off , they worry about lower earnings , which also would hurt the market .",metaphorical,N
cool,"Business confidence remains buoyant despite the October market crash , according to the survey , though it has cooled somewhat since the previous poll .",metaphorical,N
cool,"`` That remark -LRB- of the official -RRB- definitely cooled the heels of the bulls , '' said Paul Clohesy , chief dealer at Australia and New Zealand Banking Group Ltd. in New York .",metaphorical,N
cool,One trader said that the rumors of the Finance Ministry 's efforts to cool trading of the large-capitalization issues triggered the losses in the steel and heavy industrial sectors .,metaphorical,N
cool,"The report cooled bullish sentiment brought about by a smaller Brazilian crop this year , analysts said .",metaphorical,N
cool,Investor enthusiasm cooled considerably in the wake of reports that Lilco 's demand was a bargaining tactic aimed at getting its talks with the state back in high gear .,metaphorical,N
cool,"Jack Laporte , a mutual-fund manager at T. Rowe Price Associates Inc. in Baltimore , says people can find a reason to worry whether the economy shows signs of heating up or cooling off .",metaphorical,N
cool,Watson 's rhetoric is purged of offensive racial references and cooled to a sympathetic refrain about the misery of dispossessed country folk forced to sell their youngsters ' lifeblood to money-grubbing factory owners from the North .,metaphorical,N
cool,"The Oct. 19 stock market crash , however , cooled Home Group 's enthusiasm for the deal .",metaphorical,N
cool,"Still , pension plans appeared to be cooling off on their earlier infatuation with small-stock strategies .",metaphorical,N
cool,"On the other hand , the potential for the dollar to resume its recent slide if the trade report is disappointing raises the possibility that the Federal Reserve could push interest rates higher , both to boost the dollar and to cool the economy .",metaphorical,N
cool,"Not only are they being replaced by younger politicians without roots on the mainland , but Taiwan 's recently eased political atmosphere has cooled the obsession with reunification .",metaphorical,N
cool,"Instead , they spend much of their time fighting brush fires , and although Mr. Baker inherits a world in which a number of major crises appear to be cooling off , plenty of hot spots remain .",metaphorical,N
cool,The Bank of England added that it is `` too early to be sure '' whether the British government 's recent efforts to cool down Britain 's overheated economy `` will prove sufficient to restore the economy to a sustainable path . '',metaphorical,N
cool,"But the latest-quarter results were about flat with the second quarter 's $ 7.2 million , or 17 cents a share , as the rate of new orders cooled a bit from the previous period 's hot pace .",metaphorical,N
cool,"The latest rumor yesterday was that International Business Machines Corp . , which earlier had been reported to be planning to license certain Next software programs , is cooling to the idea of using the programs extensively .",metaphorical,N
cool,"Observers said the surprise move , just before the four-day midautumn festival holiday , was designed to cool the stock market investment craze .",metaphorical,N
cool,"Nasdaq indexes -- which he says are overrated as proxies for small-stock performance -- `` did cool off since the end of May , but their superior performance in the beginning of the year was so good , that should n't be any surprise to anyone . ''",metaphorical,N
cool,"Foreign central bankers like to think that with U.S. economic growth apparently cooling , the Federal Reserve is less compelled to further tighten monetary policy before the November presidential election .",metaphorical,N
cool,But Madison Avenue 's interest in Mr. Tyson is cooling because of the barrage of negative publicity about an alleged suicide attempt and his stormy marriage to actress Robin Givens .,metaphorical,N
cool,"Britain , expected to be the European growth `` locomotive '' at more than 3.5 % , recently raised interest rates again to cool off its `` overheating '' economy .",metaphorical,N
cool,The Federal Reserve has shown its alarm over wage inflation by nudging interest rates higher in an attempt to cool economic growth .,metaphorical,N
cool,"The rate increase by West Germany was a surprise , however , because some economists thought the Bundesbank would n't risk cooling its domestic economy .",metaphorical,N
cool,`` The army would n't be able to cool it down or control it .,metaphorical,N
cool,Several analysts wondered if the rise was ordered to cool down an overheating economy or rather to present a clear signal to the market that British Chancellor of the Exchequer Nigel Lawson is in command of interest rate policy .,metaphorical,N
cool,But some marketing consultants see signs that the 1980s new-product boom is cooling a bit .,metaphorical,N
cool,"He also said that if the dispute ca n't be settled by the end of the new cooling off period , Messrs .",metaphorical,N
cool,But profit-taking helped cool the rally .,metaphorical,N
cool,"While the 17 male supers who play guards and courtiers cool our heels , we are shoehorned into a room 15 feet square , reading newspapers and exchanging small talk .",metaphorical,N
cool,Today 's slogan: `` The fever of war will not cool down while -LRB- Iraqi President -RRB- Saddam Hussein is in power . '',metaphorical,N
cool,"The Boston-area condominium market , for years one of the hottest in the country , has finally cooled off .",metaphorical,N
cool,"Yesterday 's half-point increase in base rates to 9.5 % is n't likely to be enough to cool inflationary pressures because it did n't trigger a rise in mortgage rates , said Gwyn Hacche , an economist at James Capel & Co . `` Mortgage rates are one of the main mechanisms by which a change in interest rates affects the demand for consumer credit , '' he said .",metaphorical,N
cool,Yesterday 's sell-off cooled inflationary fears throughout the financial markets .,metaphorical,N
cool,"Trying to cool controversies fueled by his visit with dissidents and with Jews denied the opportunity to leave the Soviet Union , he suggested in his news conference that emigration restrictions were largely bureaucratic obstacles that he and the Soviet leader could jointly overcome .",metaphorical,N
cool,"But , he said , armed troops loyal to the Panamanian dictator `` kind of cooled that down . ''",literal,N
cool,When the Detroit Free Press cools down .,literal,N
dance,`` You 're not going to be able to dance and diddle here . '',metaphorical,N
dance,He just might dance into the 1990s .,metaphorical,N
dance,"He proposed what ministers in many countries have only danced around -- movement toward a global fixed-rate system , possibly linked to gold .",metaphorical,N
dance,"Mr. McMillin doubts a rash of food takeovers will occur , because many companies already are dancing to Wall Street 's tune .",metaphorical,N
dance,"He has been in public life a long time , and no large skeletons have come dancing out of the closet yet .",metaphorical,N
dance,"Mr. McVeigh , a seven-year Smith Barney veteran , said his department was profitable until the crash and until Primerica `` started dancing on my head . ''",metaphorical,N
dance,"The pas de deux danced the past week by Secretary of State Shultz and Senator Sam Nunn has been dreadful political ballet , with the Reagan administration discovering what happens when you choose to dance with your political enemies .",literal,N
dance,"In interviews , he says , `` you 're always dancing , always having to show your best side , every day trying to be up when you already know what the outcome will be . ''",literal,N
dance,"I , for one , am `` dancing on the ceiling . ''",literal,N
dance,Yet a stroll through any department store makes it plain that `` yuppie puppies '' have visions of dollar-signs dancing in their heads .,literal,N
destroy,"Mr. Davis openly has a bone to pick with urban renewal , but this hardly seems a prejudice on his part: Urban renewal did in fact come into Fulton and systematically destroyed the old neighborhood , and there was n't anything subtle about it .",metaphorical,N
destroy,`` Any company in this market that hiccups is just destroyed .,metaphorical,N
destroy,"The two-year-old program designed principally to stem soil erosion is reducing American exports , destroying jobs , and squandering billions of dollars on a pseudo-problem .",metaphorical,N
destroy,"This destroys cancerous cells but also wipes out the patient 's `` good '' white blood cells that guard the immune system , leaving a patient vulnerable for almost a month to death by infection .",metaphorical,N
destroy,"Excessive rates of income tax destroy enterprise , encourage avoidance , and drive talent to more hospitable shores overseas .",metaphorical,N
destroy,"Claiborne had said in its complaint last month that Avon 's failure to meet its obligation for the Fall and Christmas seasons , which together account for more than 70 % of annual sales for the venture , would `` irreparably harm and likely destroy the business . ''",metaphorical,N
destroy,"Claiborne says in the complaint that Avon 's failure to meet its obligations for the `` crucial 1988 Fall Christmas seasons , which together account for over 70 % of annual sales , '' would `` irreparably harm and likely destroy the business . ''",metaphorical,N
destroy,"`` The Jew and the bank now dominate everything: Europe and enlightenment , the whole civilization and socialism -- especially socialism , for with its help the Jew will eradicate Christianity and destroy the Christian civilization . ''",metaphorical,N
destroy,"`` If Roger had purposely set out to destroy all morale in what was once the most confident and secure company going , he could n't have done a better job , '' Mr. Lee quotes an unnamed GM executive .",metaphorical,N
destroy,"After a recent Barron 's magazine article about the fund 's woes , Kenneth Edlund , a Delmar , N.Y . , investor , groused in a letter to the publication 's editor that for five years he `` watched in disbelief as , during the great secular bull market , David Baker destroyed my young son 's $ 17 , 000 college nest egg . ''",metaphorical,N
destroy,The rollback destroyed this steady progress .,metaphorical,N
destroy,"{Ethiopian strongman Mengistu Haile Mariam} has destroyed the traditional farming economy with communist controls on prices , by confiscating all land , and by making the state the sole buyer and seller of food .",metaphorical,N
destroy,"In any event , Mr. Dhlomo understands better than do most U.S. congressmen that if the South African economy is destroyed by sanctions , so , too , will be the prospects for revolutionary , or even evolutionary , change .",metaphorical,N
destroy,"Mr. Meese of course had good personal reasons for the infernal device he left behind ; Washington 's Democrats have been trying to destroy Ed Meese since the day he arrived in town , for no reason other than that he looked like an easier target than Ronald Reagan .",metaphorical,N
destroy,"One man who felt the brunt of Mr. Atwater 's tactics is liberal Thomas Turnipseed , whose bid for Congress was effectively destroyed when Mr. Atwater surreptitiously revived a three-year-old story about the Democrat 's psychiatric treatment for depression as a young man .",metaphorical,N
destroy,"Second , the U.S. has tried to squeeze Panama 's economy without destroying it , both to spare ordinary Panamanians further suffering and to permit recovery once Gen. Noriega goes .",metaphorical,N
destroy,"`` It would be much too much to say this will destroy either the parent company or {Cosmos} , '' says Dan Nielsen , an analyst with SBCI Securities -LRB- Asia -RRB- Ltd .",metaphorical,N
destroy,But really it is the day that all four Tyrones come face to face with the ghosts that have haunted them and the demons that have nearly destroyed them .,metaphorical,N
destroy,Public reaction to this melodrama nearly destroyed the administration and solidified the belief that no moderates existed in Iran .,metaphorical,N
destroy,"Finally , that act would streamline procedures , allowing states to set or change individual permits without needless EPA review ; EPA to issue targeted requirements rather than comprehensive federal cleanup plans that destroy local initiatives ; and enforcement to become both swifter and fairer through self-executing citations reviewed by expert administrative law judges , not cases pursued in hundreds of backlogged district courts .",metaphorical,N
destroy,And the Australians felt they could tinker with their beer without destroying that image .,metaphorical,N
destroy,"An example: Last fall , Joseph Biden 's campaign was destroyed after a leaked videotape showed similarities between his speech and one given by British Labor Party leader Neil Kinnock .",metaphorical,N
destroy,"Weeks later , `` Penthouse finally realized that Dominion was intentionally destroying the deal , '' sought other financing , failed , and had to abandon the project , the judge said .",metaphorical,N
destroy,"Pace Industries Inc. was in the process of selling its Rheem Manufacturing Co. unit , a maker of water heaters , when the stock market collapsed last year and destroyed the buyer 's financing plans .",literal,N
destroy,"But a KKR spokesman , saying the RJR-Shearson group would sell more RJR assets in a takeover than KKR , denied any such plan: `` They think we want to destroy Atlanta ?",literal,N
destroy,"Astrotech went into a deep tailspin two years ago , officials say , with the explosion of the Space Shuttle Challenger , which destroyed hopes of near-term commercial space travel .",literal,N
destroy,Mr. Berg 's murderers were bent on destroying what they call ZOG -LRB- Zionist Occupied Government -RRB- .,literal,N
destroy,"The point of view of the economist here misses the essential by being too technical , namely that the values associated with a free-market economy can be destroyed by the tax system .",literal,N
destroy,A person who actually believes in something is likely to have his or her reputation and career destroyed by letting substance get in the way of image .,literal,N
destroy,"They are so consumed by their own power , by a Mussolini-like ego , that their willingness to run over normal human beings and to destroy honest institutions is unending . ''",literal,N
destroy,The CDC report did not deal with the so-called `` good cholesterol '' -- the high-density form of lipoprotein that gathers up cholesterol in the body and carries it to be destroyed .,literal,N
destroy,"Indeed , the unrelieved pursuit of sales growth for its own sake , far from creating value , often destroys it .",literal,N
destroy,`` This case is the next logical step in our efforts to put a halt to Lorenzo 's oppressive and unlawful campaign to destroy organized labor at Eastern . '',literal,N
destroy,There is n't any indication that it could destroy the AIDS virus itself .,literal,N
destroy,"Equally important , his Socialist government absorbed and then , in effect , destroyed the French Communist Party .",literal,N
destroy,"`` We do n't need the government trying to destroy the industry because of a few bad apples , '' says David L. Ganz , an ANA board member and a lawyer for some coin dealers .",literal,N
destroy,"In a test against listeria grown in cole slaw , lysozyme destroyed it without affecting the quality of the food .",literal,N
destroy,But Mr. Hewett says a prolonged argument in the Kremlin over how and when to introduce market-oriented prices could delay other reforms and even destroy them if the price issue is n't honestly resolved .,literal,N
destroy,"The plan to make Apple into a consumer marketing giant , orchestrated by both Mr. Sculley and Mr. Jobs , was pure lunacy and nearly destroyed the company .",literal,N
destroy,"This objectivity , however , need not destroy the work 's subjectivity , and Mr. Palmer is wrong in asserting that moral-rights advocates `` claim that a work of art is simply an extension of the personality of the artist . ''",literal,N
destroy,Judges thus destroyed the time frame used in assessing risk .,literal,N
destroy,"Equally important , his Socialist government absorbed and then , in effect , destroyed the French Communist Party .",literal,N
destroy,"Eric Johnson , the researcher , found that it also destroys certain kinds of botulism .",literal,N
destroy,Whether that should be welcome news or cause for alarm depends on one 's confidence in the ability of Congress to write rules for markets without destroying them .,literal,N
destroy,"The press release for an upcoming miniseries describes Nina , its heroine , as `` a manipulative woman determined to love and , if need be , destroy the men in her life . ''",literal,N
die,"Long term , he says Newnam will live or die on its efforts to stress quality .",metaphorical,N
die,"Thus , while government officials concede apartheid must die , they ca n't bring themselves to kill it .",metaphorical,N
die,"There were many who thought that the dream would die with the dreamer , but it continues on .",metaphorical,N
die,"`` We can play democracy until we die of `` democratitis acuta '' and our post mortem will be very democratic , but very dead . ''",metaphorical,N
die,"In order to focus federal resources on the SSC , its backers decided that Isabelle had to die .",metaphorical,N
die,"Roberto Macedo , president of the Association of Sao Paulo Economists , said in a statement that , `` This pact was born distorted and will die distorted . ''",metaphorical,N
die,The first time I read an article by humorist P.J. O'Rourke -- `` Among the EuroWeenies '' in Rolling Stone magazine -- I thought I was going to die laughing .,metaphorical,N
die,It recently earmarked $ 50 million to patch up the 70-year-old Mustang assembly plant ; both the plant and the car had been scheduled to die .,metaphorical,N
die,Recruit Cosmos is turning into the scandal that refuses to die -- but also refuses to spin out of control .,metaphorical,N
die,"Neither man is currently a government official , but the idea of a reprise of Mr. Kissinger 's famed opening to China in the early 1970s is so tantalizing that the rumor refuses to die .",metaphorical,N
die,"Traditions die hard , and the Fed has n't shaken its habit of targeting the real economy -- under the notion that inflation , too much money chasing too few goods , is prevented by curtailing the production of goods .",metaphorical,N
die,"A SUMMING UP: Besides rescuing the brokers , the Hong Kong government has had to commit hundreds of millions more in recent years to bail out seven banks , including Hang Lung and Overseas Trust ; though it had no legal obligation to save them , letting them die might have precipitated full-scale panic .",metaphorical,N
die,"`` We 're waiting for inspiration , one way or the other , '' one equity salesman said , adding that `` at the moment , there 's absolutely nothing to make the market die a death nor spur it on . ''",metaphorical,N
die,"But Mr. Bergen , still thinking about Dan Quayle , wants most to say in 1992 about a President Bush: `` He did n't die . ''",metaphorical,N
die,The last clatterings of a standing ovation die down .,metaphorical,N
die,"But fires that have charred about 675 , 000 acres in Alaska were left to die on their own .",metaphorical,N
die,"Soviet leader Gorbachev , in a second address to the forum , appealed to the 5 , 000 delegates to adopt his restructuring proposals , saying `` socialism will die unless we reform '' the Soviet political system .",metaphorical,N
die,"This provides greatly enhanced trouble-shooting capabilities when something does go wrong , and can even be used to automatically switch in a good spare card if something does die .",metaphorical,N
die,"`` If we do n't do something to address the needs of the urban poor , then the core of our cities will die , '' says Frank Lomax , executive vice president of the National Urban League .",literal,N
die,"Jack Scowen , a Conservative member of parliament from northern Saskatchewan , said that `` unless somebody wants to stir up a bunch of garbage , '' the language issue should be `` left to die . ''",literal,N
die,"If he and the Senate differ sharply on the answers , the treaties probably will die in the Senate , and the setback to U.S.Soviet relations will be severe .",literal,N
die,"One reason there 's room for more magazines is because so many die , industry officials say .",literal,N
die,"Other magazines may survive five , 10 , even 25 or 50 years and then die .",literal,N
die,"Jack Scowen , a Conservative member of parliament from northern Saskatchewan , said that `` unless somebody wants to stir up a bunch of garbage , '' the language issue should be `` left to die . ''",literal,N
dissolve,"In the extreme we have revolution , where the existing social contract is dissolved .",metaphorical,N
dissolve,Puma spokesman Uto Duethorn said Mr. Becker and Puma mutually agreed to dissolve the agreement this month .,metaphorical,N
dissolve,"So , as the team investigating the disaster homed in on two top generals , on May 27 President Zia dissolved the civilian side of the government , alleging the civilians were corrupt and that Pakistan needed more religion .",metaphorical,N
dissolve,The Ukrainian Autocephalous Orthodox Church was formally dissolved by Moscow in January 1930 .,metaphorical,N
dissolve,"`` Of course , the bondholders will have to ask: Is dissolving the company better than reorganization ? ''",metaphorical,N
dissolve,Tennis Lady said that after the sale it expects to `` dissolve the company or invest in new businesses . '',metaphorical,N
dissolve,"He acknowledges that some will see this as a threat to freedom , but he soothes: `` Liberation , however , comes in various forms , either by overthrowing the external compulsion or dissolving the inward objection through a change of will , through sublimation . ''",metaphorical,N
dissolve,"And its matter-of-fact citizens are taking the long view-as befits a place where , in the words of Mr. Dyer 's Boonville history , `` past and present slowly dissolve one into the other . ''",metaphorical,N
dissolve,"This relationship will be characterized by caution and hard-nosed realism about mutual interests , say Soviet and Chinese officials , rather than by the euphoria and stifling closeness of the past that dissolved into suspicion and then bitter border clashes in the l960s .",metaphorical,N
dissolve,"The lower court had enjoined the effect of its decision , pending the appeal , but the appeals court dissolved the injunction .",metaphorical,N
dissolve,"Many doubt those ties will ever dissolve , and wonder how lasting the Thatcher Revolution will prove .",metaphorical,N
dissolve,"But in the intervening years , so much criticism has been poured upon Chamberlain 's failed policies that they have dissolved into caricature .",metaphorical,N
dissolve,"Afterward , Enrique `` Quique '' Galarza , Cojunto 's lively , goateed , 40-ish lead singer , explained that he and his colleagues recently dissolved a pre-existing group and started Cojunto , so they do n't have any home turf dates either .",metaphorical,N
dissolve,This was one of the lesser-known reasons why President Zia abruptly dismissed the whole cabinet and dissolved the national assembly on May 29 .,metaphorical,N
dissolve,"The appeals court 's decision affirmed sanctions of $ 50 , 000 against Ray L. LeFlore and $ 50 , 000 against his former law firm , Pavelic & LeFlore , which was dissolved in 1986 after U.S. District Judge Robert W. Sweet imposed the sanctions .",metaphorical,N
dissolve,"Cannons Engineering , a closely held concern that was convicted several years ago for criminally falsifying incinerator reports it filed with the state of Massachusetts , was dissolved as a corporation , EPA officials said , but has been technically `` revived '' for purposes of litigation .",metaphorical,N
