verb,sentence,human_label,cluster_label
absorb,"An Energy Department spokesman says the sulfur dioxide might be simultaneously recoverable through the use of powdered limestone , which tends to absorb the sulfur .",literal,L
absorb,The yellow beta carotene pigment absorbs blue -LRB- not yellow -RRB- laser light .,literal,L
absorb,"This time , the ground absorbed the shock waves enough to transfer her images to the metal in bas-relief .",literal,L
absorb,"`` Vitamins could be passed right out of the body without being absorbed , '' he says .",literal,L
absorb,"As Eliot wrote: `` In a warm haze , the sultry light is absorbed , not refracted , by grey stone . . . . '' and flowers do indeed `` sleep in empty silence . ''",literal,L
absorb,"New Pig Corp . , Tipton , Pa . , offers a hot-dog-shaped sponge that absorbs polluting liquids around factory machines .",literal,L
absorb,Mr. Gallas says he began looking into melanin about five years ago when he was working on solar energy and was looking for materials that absorb sunlight .,literal,L
absorb,"The fatty deposits have a yellowish hue and therefore absorb more of the yellow laser energy than the surrounding , almost colorless artery wall .",literal,L
absorb,"Mr. Filisko says his fluids do n't rely on absorbed water , and perform better as temperatures rise .",literal,L
assault,"For example , he carefully steered clear of controversies such as New York 's Tawana Brawley case , where some rabble-rousing lawyers are charging that a young black woman was assaulted and raped by whites .",literal,L
assault,"Last year , the NRA ran a newspaper ad featuring a harrowing photo of a frightened woman and asserting that a 20-year-old American woman has a 72 % chance of being raped , robbed or assaulted in her lifetime .",literal,L
assault,"Among the tantrums he admits: heaving a faulty phone across the control room , kicking in a TV screen to force NBC to buy a new one , and assaulting construction workers who were too noisy during taping .",literal,L
assault,Mr. Tyson has denied that he tried to kill himself and that he assaulted his wife .,literal,L
assault,"He was detained on June 23 , and for two weeks he was regularly assaulted by South African police .",literal,L
assault,"John Gil , a San Diego landlord , and Mike Black , an apartment manager , were sued in state Superior Court in San Diego by a tenant who was assaulted by a pet monkey owned by two other renters .",literal,L
assault,"Mr. Guez , of Old Westbury , N.Y . , also is currently under indictment and awaiting trial for allegedly assaulting a deputy U.S. marshal who tried to seize Sasson records last year at the posh $ 5.5 million Manhattan townhouse where Mr. Guez once resided .",literal,L
attack,One sure sign has reappeared to attest that the interests of the United States must be taking a turn for the good in El Salvador: The country is being attacked .,literal,L
attack,"From the 14th century to Corregidor in 1942 , such forts had to be taken by storm before attacking ships could pass .",literal,L
attack,"Insects begin attacking the snags almost immediately after a fire , and the charred trunks are likely to be toppled by the wind .",literal,L
attack,"An Agence France Press dispatch on August 8 reported that an Afghan air force plane was shot down by a Pakistani F-16 while attacking Afghan refugee camps 30 kilometers inside Pakistan territory , near Miram Shah .",literal,L
attack,"-- The other day , U.S. helicopters fired on Iranian gunboats that were preparing to attack a Panamanian ship near Farsi Island .",literal,L
attack,"Prince Norodom Sihanouk , the former Cambodian leader , said this week he was withdrawing from the resistance because the Khmer Rouge continues to attack his forces along the Thai-Cambodia border .",literal,L
attack,"They point out that three members of Abu Nidal 's organization are in jail in Greece on separate charges of attacking a synagogue in Rome , weapons smuggling , plotting to assassinate the Jordanian charge d'affairs in Greece , and possessing weapons in prison .",literal,L
attack,The Sandinistas have now offered reasons for attacking and arresting anti-government demonstrators Sunday -LRB- `` Somocista Bands Invade Nandaime '' -RRB- ; for closing Radio Catolica -LRB- `` lack of respect for constitutional order '' -RRB- ; for arresting a Conservative Party leader -LRB- `` the principal instigator '' -RRB- .,literal,L
attack,"In Greece , an official said the terrorists who attacked the liner in the Aegean Sea may have been pro-Iranian Arabs trying to hijack it .",literal,L
attack,The incident occurred after an Aegis cruiser mistook the large passenger jet for an attacking F-14 fighter .,literal,L
attack,Phalanx can be overwhelmed when a ship is attacked by several missiles at once -LRB- the Stark was struck by two Exocets -RRB- .,literal,L
attack,"The administration tried again in mid-1987 , suspending military and economic aid to Panama after rioters , led by some government officials , attacked the American Embassy in Panama City .",literal,L
attack,U.S. officials said evidence suggests that a Japanese terrorist arrested last month in New Jersey with homemade bombs was on his way to attack a target in New York City .,literal,L
attack,The ship had n't attacked U.S.-flag vessels or been involved in mine-laying .,literal,L
attack,"Here in Masaya , supporters of a group known as the Mothers of Political Prisoners were brutally attacked by turbas in a well-documented incident in March .",literal,L
attack,Sparrows used to have a rep for selectively attacking yellow crocuses such as `` E.A .,literal,L
attack,"American officials have concluded that the Kuwaiti hijacking is the work of a Lebanese Shiite terrorist named Imad Mugniyah who has been trying for more than four years to free his wife 's brother from prison in Kuwait , where he was convicted in 1984 of building a bomb used to attack the U.S. Embassy .",literal,L
attack,"Iran said its jets bombarded an Iraqi military base and oil refinery in Baghdad , and Iraq said its forces attacked 10 Iranian towns .",literal,L
attack,Tamil militants attacked and set fire to two Moslem fishing villages in eastern Sri Lanka .,literal,L
attack,"Iranian gunboats attacked an Indian tanker in the Persian Gulf , setting the vessel ablaze and wounding at least one crew member , gulf-based shipping executives reported .",literal,L
attack,"In northern Nicaragua , Honduran jets attacked a Sandinista military headquarters .",literal,L
attack,"Rioting Iranians attacked the Soviet Union 's Embassy in Tehran , accusing Moscow of supplying Iraq with missiles used in recent raids on Iran .",literal,L
attack,The PLO said it would attack Israeli targets to avenge Sunday 's killing of three guerrillas and Monday 's bombing of a ship intended to carry Palestinian deportees to Israel .,literal,L
attack,"In the Persian Gulf , Iran twice attacked a Norwegian tanker .",literal,L
attack,"This expert also believes that Pyongyang might use helicopters it has bought from the West , which are identical to those used by the Seoul army , to attack student demonstrators .",literal,L
attack,His antics once provoked an elderly ruling-party legislator to attack him with a cane .,literal,L
attack,The view contradicts administration claims that Moscow knew it was attacking a non-military target .,literal,L
attack,"It is to this purpose that SDI laser technology can be uniquely directed , where moving targets can be attacked almost immediately after they are detected .",literal,L
attack,"Here in Masaya , supporters of a group known as the Mothers of Political Prisoners were brutally attacked by turbas in a well-documented incident in March .",literal,L
attack,Pakistani cheating could prompt Moscow to declare the accords void or to attack Afghan-resistance camps in Pakistan .,literal,L
attack,"None of the Democratic leadership in the House or Senate was notified about the move , unlike when the U.S. ordered troops into Grenada in 1983 or last October when U.S. forces in the Persian Gulf attacked an oil platform that had been converted to a military facility .",literal,L
attack,"Tamil rebels attacked a village in eastern Sri Lanka , killing at least 16 people in the assault on homes of the majority Sinhalese .",literal,L
attack,"As the recent Ikle-Wohlstetter report , `` Discriminate Deterrence '' -LRB- the source of the nearby maps -RRB- , to President Reagan makes clear , it 's far more likely that the Soviets would attack first on the more vulnerable fringes of the alliance , perhaps in the Persian Gulf or Norway .",literal,L
attack,"Because a commitment to hold open the 74.4 miles of supply road to Khost from Gardez would require even more Soviet casualties and force , the optimists surmise that the Soviets are attacking Khost to get out of Afghanistan .",literal,L
attack,"The point of this review is not necessarily to let off the Eritreans , who have recently come under deservedly strong criticism for attacking two food convoys , but to demonstrate how famine in northern Ethiopia is part of something much broader and more complex than drought .",literal,L
attack,"The only thing certain is that a Korean merchant wholly dependent on the good will of his customers would be crazy to attack a black grandmother in a virtually all-black neighborhood -- and Mr. Chung , who cleaned fish for three years to scrape together the money to buy his market , seems anything but crazy .",literal,L
attack,"These Protestants retaliate by physically attacking Catholics , Mr. Donnelly says .",literal,L
attack,These do n't protect anything and are n't designed to kill attacking guerrillas .,literal,L
attack,"I arrived in Vietnam in early 1968 , as green as the beret I wore , and was assigned to the Special Forces `` A '' team that had the dubious distinction , two weeks later , of being one of the first attacked during the Tet offensive .",literal,L
attack,"Next , a member of his audience , attired in a garment resembling the flag , attacked him .",literal,L
attack,"This suggests a panicky response from the Vincennes , particularly since a Pentagon air-combat specialist quoted by Mr. Kaplan in the Boston Globe said that an attacking F-14 probably would be traveling `` at at least 550 to 580 knots , '' 100 knots faster than Adm. Crow says the Airbus was flying , and `` well under 1 , 000 feet . . . .",literal,L
attack,"But Iran 's positions , overrun in last Saturday 's attack on Majnoon , were just a few thin lines of hillocks ; the fortifications of an army that expects to attack rather than defend .",literal,L
attack,"On Friday , Commander Abdul Haq 's troops attacked Kabul Airport with new Sacher incendiary rockets .",literal,L
attack,"The best of show in painting , Oleg Stavrowsky 's 40-inch by 72-inch oil of a stagecoach being attacked by bandits , went for $ 14 , 000 .",literal,L
attack,"Preassembling attacking teams on a number of single bases , so that the loss of no one base could mess things up too badly , would help , although it would be a logistical nightmare .",literal,L
besiege,"In 1347 , Mongols besieging the Black Sea port of Caffa began to sicken and die from the plague .",literal,L
besiege,"When radicals besieged his hotel while he was visiting Seoul last week , he promised them he would make yet another effort to play up to North Korea -- by renewing the offer to let the North host several Olympic events .",literal,L
besiege,Thousands of Chinese soccer fans battled police and besieged a rival team 's hotel during a riot Monday night .,literal,L
cool,"Company officials could n't be reached for elaboration , but Gary P. Smaby , who follows the industry for Needham & Co . , said he understood that cooling problems had developed that could delay delivery of the machine .",metaphorical,L
cool,"Justin makes building products , cooling towers and boots .",metaphorical,L
cool,"The Nuclear Regulatory Commission fined Detroit Edison Co . $ 25 , 000 for the faulty design of a core cooling system at the Detroit-based utility 's Fermi 2 nuclear reactor .",metaphorical,L
cool,"Zero makes cases , cabinets and cooling equipment for the electronics industry and industrial and consumer use .",literal,L
cool,"You have to build up the equipment to a certain power level , test it , cool it down , then possibly repair it , and it may take months to bring it up again . ''",literal,L
cool,"For an auto , Mr. Loehrke envisions the warm end of the pipe heated by the radiator and the condenser end cooled by the outside air .",literal,L
cool,"Then again , other gases might cause a lot of clouds to form , blocking sunlight and cooling things off .",literal,L
cool,They can generate such heat they need cooling fans ; trunk-mounting avoids turning the passenger compartment into a blast furnace .,literal,L
cool,Heavy water is used to control and cool the reaction of small research reactors .,literal,L
cool,"Japanese companies already are at the forefront of development of an older generation of superconductors , those that have to be cooled almost to absolute zero .",literal,L
cool,Beer flowed from big pitchers as a cooling obbligato to the hot sounds .,literal,L
cool,"Engineers in uniforms and hardhats are everywhere , many maintaining the technological heart of the levitating train: its roadbed of specially cooled superconducting magnets .",literal,L
cool,"The revolutionary gallium arsenide circuits used in a forthcoming model , the Cray-3 , experienced cooling problems that resulted in millions of dollars of added costs .",literal,L
cool,"Normal cooling costs are defined as the expected costs to cool a residence in average August weather , which is based on temperature records for the past 30 years .",literal,L
cool,The mold is then cooled and dried and the lid peeled off .,literal,L
cool,"Home here is a 12-by-15-foot room , cooled by two portable fans and crowded with three beds and boxes of clothes .",literal,L
cool,"A front is then expected to move in but it will cool temperatures only slightly , to 40 to 50 degrees .",literal,L
dance,"The picture spans the quarter-century between the mid-'50s and the early '80s , which gives Ms. Lange the chance to frequently change her hair style , to wear a variety of clothes and to dance the Twist .",literal,L
dance,"They were greeted by dancing pigs , flying pigs and several hundred thousand people pigging out .",literal,L
dance,"Joffrey Ballet: The bicoastal company dances its first Manhattan season since the death of founder Robert Joffrey , whose own `` Remembrances '' pas de deux will be revived .",literal,L
dance,"Bill Byron , a regional sales manager for Columbus Wallcovering Co . , danced wildly down the runway in a purple `` country kitchen '' material .",literal,L
dance,"Twenty-eight thousand buildings were leveled in the quake , but a few years later , 20 , 500 new ones had been built , and people of the reborn city were dancing in the streets .",literal,L
dance,"And for those of you planning ahead , this year the troupe will dance `` The Nutcracker '' Dec. 1-31 . -LRB- 212 -RRB- 870-5690 .",literal,L
dance,Anyone can dance the hokey-pokey .,literal,L
dance,"`` This music is n't meant to be watched , it 's intended to be danced , '' Mr. Gutierrez pleads from the stage .",literal,L
dance,"At the end of the group 's 40-minute set , the audience members have decided they do n't care about the museum 's rules either , and they 're dancing in the aisles .",literal,L
dance,"`` I have undergraduate degrees in chemistry and marketing , but I 'm going to law school in the fall and I hope this will pay for it , '' says Sasha , who wears eyeglasses when she dances . -LRB- `` These glasses are fake , '' she explains .",literal,L
dance,"Most of the rules are left unspoken: Do n't move , do n't talk , do n't laugh , do n't sneeze -- and , definitely , do n't dance .",literal,L
dance,"Then watch women dancing nude at Tattletales , a blue-collar strip joint down the road with trucks outside and a Welcome Democrats sign on the roof .",literal,L
dance,"Even more inadvertently hilarious is Alexander Godunov , the Soviet defector who used to dance for a living .",literal,L
dance,"Charles Jude , Mr. Nureyev 's partner , danced with a youthful resilience that reflected unfavorably on the latter 's growing infirmity .",literal,L
dance,"When they 're not in front of the camera , the Toons sing and dance at their version of Harlem 's Cotton Club .",literal,L
dance,"Even as danced by four of ABT 's most talented males , John Gardner , Robert Hill , Kevin McKenzie and the astonishingly agile Robert Wallace , Mr. Tippet 's latest work is tough going .",literal,L
dance,Racism has gone largely unnoticed as images of Brazilians of all shades dancing the samba at Carnival created a sense of racial harmony .,literal,L
dance,"The leads in the second performance -LRB- Ludmila Lopukhova and Simon Dow -RRB- were better than those at the premiere -LRB- Karin Averty and Jean-Charles Gil -RRB- , but there were more enjoyable performances from younger members of the company , such as Joanna Berman , Wendy Van Dyck and Mikko Nissinen , who danced the first act pas de trois on opening night , and Andre Reyes , who replaced the latter on the following afternoon .",literal,L
dance,He tap-danced around the stage to his own falsetto and flopped to the floor to the accompaniment of his booming bass .,literal,L
dance,"When Danny dances with Helen , who is dubious about the whole enterprise , he tells her that it 's all a surprise for her , it 's her Valentine 's Day card .",literal,L
dance,"Whether these dancers could ever meet the requirements of `` Raymonda Variations '' and `` Symphony in C , '' the ballets they danced in New York , is doubtful .",literal,L
dance,"Television commercials expected to air in mid-April in New York and Miami will feature the homespun pair dancing the salsa , advertising sources said .",literal,L
dance,Khopa and Ticha danced and juggled soccer balls at a Radio City Music Hall press preview announcing an upcoming tour of the Moscow circus .,literal,L
dance,"Mr. Waters sets his sights on the `` hairhoppers , '' the polished amateurs who dance on `` The Corny Collins Show , '' his version of `` American Bandstand . ''",literal,L
dance,"They began from scratch , amateurs learning to sing and dance and act , working up to 18 hours a day , almost every day .",literal,L
dance,"Plucking bonbons with a pinkie in the air , or daintily miming a billiard shot , he seems almost to be dancing through the role , a rosy cherub in grownup clothing .",literal,L
dance,Upstairs over the bufyet is the ballroom where Natasha danced .,literal,L
dance,"With their wives and girlfriends in Mexico , it 's common to see men dancing alone here .",literal,L
dance,"`` I was so happy that I practically danced back into the house , '' Mr. Popejoy says .",literal,L
dance,"Whether these dancers could ever meet the requirements of `` Raymonda Variations '' and `` Symphony in C , '' the ballets they danced in New York , is doubtful .",literal,L
dance,"Television commercials expected to air in mid-April in New York and Miami will feature the homespun pair dancing the salsa , advertising sources said .",literal,L
dance,"`` Seems like you 'll never make it to the top unless you know how to dance , '' the announcer intones .",literal,L
dance,"Mr. Waters sets his sights on the `` hairhoppers , '' the polished amateurs who dance on `` The Corny Collins Show , '' his version of `` American Bandstand . ''",literal,L
dance,"This three-part `` Nature '' miniseries presents the history of the area and its amazingly rich flora and fauna , including bat-eared foxes , dancing ostriches , shrimp-eating flamingos and leaping bush babies .",literal,L
dance,"`` Sam is one of a kind , '' Mr. Glass said , adding that he was n't `` going to dance the hula on Wall Street . ''",literal,L
dance,"Tomorrow night at New York 's swank Pierre Hotel , 200 advertising executives in black tie will dance to the jazz of Ann Hampton Callaway and dine on grilled salmon , filet of beef Peregourdine and pastry tulips filled with praline ice cream .",literal,L
dance,"As the wiry Mr. Rios dances with a plump , middle-age woman , he yells in Spanish , `` I 'm legal now . ''",literal,L
dance,"With their wives and girlfriends in Mexico , it 's common to see men dancing alone here .",literal,L
dance,And a family in adjacent Hamilton County turned to him after it got little response from local authorities to its complaints about people dancing and praying in a nearby graveyard .,literal,L
dance,"Yet when ordered to dance by his master , he gamely sprinkles a little sand on the ground and shuffles through a series of rapid dance steps ending in a pathetic little pawing motion that symbolizes his entrapment .",literal,L
dance,She watched an older couple dancing outside in the restaurant 's courtyard .,literal,L
dance,They danced to the funk rock of a live band and grilled hot dogs and ribs .,literal,L
dance,"`` And there 's Sam Nunn dancing presumably with his wife , '' she says , squinting hard from her distant perch .",literal,L
dance,"In the third `` mansion , '' the lascivious emperor , Diocletian -LRB- Patrick Dupond -RRB- , dances a pas de deux with the youth and then repeats it , almost step for step , with the queen .",literal,L
dance,"Set up on a strobe-lighted stage , Barbie and her buddies appear to move all by themselves , holding guitars and dancing up a storm amid flashing blue and pink lights .",literal,L
dance,"Meanwhile , though , we may ask what will happen to dance back here , where the facilities Brussels has offered Mr. Morris , including a $ 1.5 million annual budget , are apparently not to be thought of .",literal,L
dance,"And one of the congregation 's most remarkable and fervent prayers came from worshipers toward the back of the church who began dancing and chanting: `` Come , Tambo , come . ''",literal,L
dance,"In company with Susan Jaffe , Christine Dunham and Leslie Browne , Mikhail Baryshnikov , formerly of Leningrad 's Kirov Ballet , and now director of American Ballet Theatre , danced the revised version of Balanchine 's sublime `` Apollo '' with a blend of spontaneity and concentration that charged the entire evening with wonder .",literal,L
dance,"Indeed , the musical 's whole point is expressed through a single climactic , apocalyptic number called `` Rockland , '' in which the cast , suddenly dressed in hip , punky clothes , leather jackets and army fatigues , sings `` We dance together in a bar to the same creeping sense of ennui . ''",literal,L
dance,Instead of dancing they watch rock video . '',literal,L
dance,"In his own weird way , Mr. Waters has captured the gleeful garishness of the early '60s , when high-school girls wore demure bows in their ratted hair and deadened their lips with palest pink lip gloss -- and believed that racial harmony was inevitable if teens of all flavors could dance together on TV .",literal,L
dance,"For the group dances , Mr. Morris devised choreography that was more athletic and no less compelling .",literal,L
dance,"In the third round , though , Holmes got up on his toes , danced some , and flicked a few punches .",literal,L
destroy,"He said incinerator temperatures of as much as 1 , 000 degrees Celsius are enough to destroy the mineral .",literal,L
destroy,"Police , meanwhile , raided Arab villages and destroyed the homes of suspected activists .",literal,L
destroy,"`` This memo was withdrawn and destroyed and someone got it by going through our trash and resurrecting it , '' the EDS spokesman said .",literal,L
destroy,"A virus is a computer program , often hidden in apparently normal computer software , that instructs the computer to change or destroy information at a given time or after a certain sequence of commands .",literal,L
destroy,"`` You have to destroy another human being , '' Mr. Espinosa says .",literal,L
destroy,"Soybean seed sales skidded last spring in South Carolina , and dealers were forced to destroy tens of thousands of bags .",literal,L
destroy,"Horace Furumoto , chairman and chief executive officer , said the company recently has completed its first phase as a public company , which included the development of lasers for removing birthmarks and for destroying kidney stones without surgery .",literal,L
destroy,R.G. Barry Corp. said that fire destroyed one of its Mexican plants and that as a result projected 1988 sales are expected to be reduced 3 % to 4 % .,literal,L
destroy,"Tropical storm Chris spawned tornadoes that damaged houses , destroyed mobile homes and caused at least one death in the Carolinas before gradually weakening .",literal,L
destroy,"This is also true , I believe , with respect to the famous Buddhist university at Nalanda , India , which too was destroyed by the Moslem hordes , who had no respect for others ' learning .",literal,L
destroy,"But as most of those certificates are destroyed in favor of computer records , the investor who requests a certificate will have to wait until it 's delivered by the city or state that issued the bond .",literal,L
destroy,"Last year , Mexico claimed that the equivalent of 6 , 200 acres of poppies were destroyed , up from 5 , 900 acres the previous year .",literal,L
destroy,"Israel has agreed to develop an interceptor missile for the U.S. that would destroy short-range ground-to-ground missiles , state-owned Israel Aircraft Industries said .",literal,L
destroy,"And Mr. Gorbachev 's proposal to remove aircraft -- which easily can fly back to Central Europe during a crisis -- would be meaningless unless they are destroyed , Mr. Chalmers says .",literal,L
