verb,sentence,human_label,cluster_label
kill,Consolidated Rail Corp. said it agreed to pay $ 58 million to settle all claims outstanding on behalf of 16 people killed in a 1987 train collision .,literal,L
kill,"`` If {Shorty} puts down his arms , the campesinos themselves will kill him . ''",literal,L
knock,"And most of the jobs will go to candidates sought out by search firms , not those knocking on headhunter doors .",metaphorical,L
knock,"We union members were there backing John Kennedy with our money , door knocking and votes in 1960 .",metaphorical,L
knock,"I knocked at the bedroom door , and Father said the security company had just called to say there were certain `` irregularities '' that prevented them from keeping a watch over our store .",literal,L
knock,"In northern Botswana , where the poor quality of their ivory protects elephants from poachers , the elephant population is out of control and has eaten and knocked down many square miles of scrubby forest .",literal,L
knock,Another trader almost had his glasses knocked off in the jostling .,literal,L
knock,"-- Last September , 22-year-old Kimberly Isaac of Baton Rouge , La . , was badly scraped over a large part of her body when a 1977 LTD she had just parked in a grocery-store lot backed up , knocking her over and dragging her in circles .",literal,L
knock,"Cale Yarborough 's car spun out of control on the first turn , '' knocking out nine other vehicles .",literal,L
knock,"Where Chekhov has Lopakhin knocking over a small table , Mr. Dennehy goes crashing into a big , folding screen that 's standing in for a wall .",literal,L
knock,"Earl , a cat with the stuffing knocked out of it -LRB- ostensibly by a car -RRB- , comes with a death certificate .",literal,L
knock,"-- Last September , 22-year-old Kimberly Isaac of Baton Rouge , La . , was badly scraped over a large part of her body when a 1977 LTD she had just parked in a grocery-store lot backed up , knocking her over and dragging her in circles .",literal,L
knock,I confess I fear word will get out that `` the man in the green house is a soft touch '' -- and that I will soon have several `` Clints '' knocking on my door .,literal,L
knock,The curator who answered our loud knocking was so happy to have two Americans visit she opened up the entire museum for us .,literal,L
knock,"The hug knocked off Spinks 's hat , a broad-brimmed , white number .",literal,L
knock,Rhinos wearing tutus daintily knock workmen aside .,literal,L
knock,"`` It knocked me off my chair , '' says Mr. Bodner , a partner in Howrey & Simon , a Washington firm .",literal,L
knock,"Once , he said , the page turner at a professional concert knocked over the whole score , causing a crescendo where none was intended .",literal,L
lend,Capital is no problem ; banks and insurance companies are eager to lend money to potential buyers .,metaphorical,L
lend,"But to win , he donated $ 18 , 000 of his personal savings and lent his campaign $ 107 , 000 more .",literal,L
lend,"Nonetheless , international bankers are ready to lend .",literal,L
lend,"Because $ 15 billion or more of long-term loans must be raised by whichever bidder wins the giant food company , they say , banks in lending syndicates for that deal may have trouble finding buyers in the secondary market for portions of their loans .",literal,L
lend,"Its administration expenses come to only 0.5 % of its assets -- an enviably low figure -- and its rock-solid finances , coupled with the good repayment record on its lending , have earned it an AAA rating on the world 's capital markets where it raises nearly 90 % of the capital that it lends .",literal,L
lend,"Since the international debt crisis erupted in 1982 , banks have been increasingly reluctant to lend to Latin American countries .",literal,L
lend,"But few , if any , have guidelines against lending to offshore entities that are South African-controlled or that have a significant South African minority interest .",literal,L
lend,And only 20 % reported that their customers lent them engineers to supplement their own technical expertise .,literal,L
lend,"Changes in Florida Federal 's rate on its Liquidity Plus money market account are linked to a seven-day average for the federal funds rate , which is the rate on reserves that banks lend one another overnight .",literal,L
lend,"The reason is that , individually , banks have considered this sort of lending risky because the margins are too slim .",literal,L
lend,"The rate on funds , or reserves that banks lend each other overnight , has been hovering between about 8 % and 8 1 4 % recently .",literal,L
lend,"Some bankers said at the time that Bolivia 's buy-back was a unique exercise for one of the poorest Latin American countries , where few banks would wish to lend again .",literal,L
lend,"The thrift will be able to lend 10 % of its assets , or about $ 1.5 billion , to the merchant bank , officials said .",literal,L
lend,"He says he lent $ 13 , 000 to Victor Cohen , a friend of Mr. Galvin 's and an Air Force assistant secretary whose phone was tapped by federal investigators .",literal,L
lend,"The rate on Federal funds , or reserves banks lend one another overnight , could climb above 8 % by tomorrow from just under 7 3 4 % , he said .",literal,L
lend,The rest would go to more than 30 international banks that lent the National Bank money before it was seized and closed by Brunei in November 1986 .,literal,L
lend,"James D. Harper Jr . , a big Chicago investor and former real estate lending chief at Continental Illinois Corp . , said he lent hundreds of millions of dollars to Mr. Zell over the years , it was always repaid , and that Mr. Zell nearly always made out well .",literal,L
lend,"Mellon 's mortgage unit , which lent primarily in depressed Southwestern states , is responsible for a large amount of Mellon 's nonperforming domestic assets .",literal,L
lend,No bank would lend him money .,literal,L
lend,"Having expanded to handle the 1986 and 1987 mortgage crush , lenders flush with deposits have money to lend but not enough borrowers .",literal,L
lend,"AMR Corp. 's American Airlines agreed to lend Braniff Inc . , Dallas , as much as $ 21 million , and also purchase certain Braniff assets for as much as $ 23 million , according to documents filed with the Securities and Exchange Commission .",literal,L
lend,ERG Resources Inc. said Australia 's Giant Resources Ltd. agreed to lend the company 43 million Canadian dollars -LRB- US $ 35.5 million -RRB- and provide security for a C $ 60 million gold loan planned by ERG .,literal,L
lend,"The U.S. Export-Import Bank could assist the Polish transaction , but it 's legally forbidden to lend funds to Romania .",literal,L
lend,`` We lend to the rich to improve their quality of life . '',literal,L
lend,"He adds , `` It seems to me it will be desirable , in the present environment , to see what can be done '' to reduce debt , rather than just lend new money .",literal,L
lend,"About 165 , 000 pieces had been lent to government offices and embassies around the world , and many never came back , he said .",literal,L
lend,But bankers that lend to farmers suddenly are worrying anew about their borrower 's financial health .,literal,L
lend,"Earlier in the month , the rate on reserves that banks lend each other overnight was averaging around 7 3 8 % .",literal,L
lend,"Mr. DeBartolo lent Campeau $ 480 million to help finance its Federated takeover , and much of Campeau 's U.S. real estate assets are pledged as security for the loan .",literal,L
lend,"The rate on funds , or reserves that banks lend each other overnight , averaged about 7 1 2 % , up from 7.42 % Friday .",literal,L
lend,"A recently proposed $ 350 million loan , which would have cleared up most of these overdue payments , had to be scaled back to $ 330 million and is in danger of foundering , partly because banks have been slow to respond to the call to lend .",literal,L
lend,Mr. Camdessus said it was clearly in banks ' own interest to lend more and `` strengthen the value of -LRB- their -RRB- existing loan claims . '',literal,L
lend,So the same Congress that runs a budget deficit so that foreigners have to lend us money wants to make it more difficult for foreigners to lend us money .,literal,L
lend,"Since late January , the Fed has pushed the rate on federal funds , or reserves banks lend one another overnight , down a quarter of a percentage point to 6 1 2 % and then back up to about 6 3 4 % .",literal,L
lend,The Farm Credit System Assistance Board said the government will provide more than $ 20.5 million to pay off stockholders in six lending units now being liquidated .,literal,L
lend,The IDA also will lend $ 17.6 million to the Yemen Arab Republic for agricultural projects .,literal,L
lend,"The Federal Home Loan Bank Board , as expected , adopted a resolution intended to reassure Wall Street firms that have lent about $ 12.6 billion to the thrift unit of troubled Financial Corp. of America .",literal,L
lend,"Oh , for the day when we all drive Yugos to our stagnant jobs , secure in the knowledge that no one will lend us money .",literal,L
lend,Hiring British bankers is helping Japanese financial institutions develop lending business with medium-sized corporate borrowers .,literal,L
lend,"The constitutions of our states commonly forbid lending the credit of the state to private firms , although in recent years tax-abatement and industrial-development incentives have been common exceptions to the general rule .",literal,L
lend,"Mexico wants to be able to borrow from international banks again , and retiring its bank debt at about 70 cents on the dollar may discourage many banks from lending it more money , bankers said .",literal,L
lend,"Other gems include stories about why Colgate-Palmolive 's Soaky bubble bath proved a marketplace dud -LRB- the suds went flat when kids urinated in the bathwater -RRB- , and how Norton Simon made a bundle by outwitting its bankers -LRB- anticipating higher interest rates , the company sold $ 250 million in debentures at 9.5 % in 1979 , and a year later lent the money at 17 % and 18 % to the same institutions , such as the Bank of America , that had bought the bonds -RRB- .",literal,L
lend,"Federal law prohibits banks from lending to federal campaigns except `` on a basis which assures repayment , '' wording which at least some FEC commissioners interpret as requiring a firm pledge of existing collateral .",literal,L
lend,"The company had a $ 14.24 billion working capital surplus at year end , but $ 13.98 billion of that came from money lent by GMAC to the parent , which took over financing of wholesale sales to dealers .",literal,L
lend,"But earlier , the real estate concern said its financial adviser , First Boston Corp . , had agreed to lend as much as $ 900 million in short-term subordinated debt , in addition to $ 200 million of `` bridge loans . ''",literal,L
lend,"The funds rate , which is the rate on reserves that banks lend each other overnight , strongly influences many other rates , including those that dealers must pay to finance their bond holdings .",literal,L
lend,"The revised terms stem from ITT 's review of Portland , Ore.-based American Network 's operations , including actual and expected losses , plus ITT 's plan to lend the company short-term financing .",literal,L
lend,"Edward J. DeBartolo , a Youngstown , Ohio , shopping store operator , has agreed to lend Campeau 's U.S. holding company $ 400 million for the Federated bid .",literal,L
lend,"The rate on funds , or reserves that banks lend each other overnight , averaged 5.80 % , according to an estimate by Fulton Prebon -LRB- U.S.A. -RRB-/-RR",literal,L
lend,"They will change their attitude -- and will lend money to Brazil -- they have too much at stake not to , '' says Rimmer de Vries , chief international economist at Morgan Guaranty Trust Co .",literal,L
lend,"Manufacturers Hanover Ltd . , the London-based investment-banking unit of Manufacturers Hanover Corp . , is organizing banks to lend $ 160 million to Super Octanos C.A . , a 51 % Venezuelan state-owned joint venture .",literal,L
lend,"The federal funds rate , which is the rate on reserves banks lend each other overnight , averaged 6.79 % Friday , according to Fulton Prebon -LRB- U.S.A. -RRB-/-RR",literal,L
lend,"Colombia signed a $ 1 billion loan with 112 of its bank creditors , showing that banks still are willing to lend to the more-creditworthy Latin American countries .",literal,L
lend,"In any case , Mr. Luce pointed out , banks could be more reluctant to lend Texaco money in light of this huge new claim .",literal,L
lend,"Among short-term interest rates , the rate on federal funds , or reserves banks lend each other overnight , averaged 6.81 % , according to Fulton Prebon -LRB- U.S.A -RRB- .",literal,L
lend,"Banks probably will raise their prime , or base , lending rates this spring or early this summer , according to Mellon Bank 's Mr. Robertson .",literal,L
lend,"One branch of Superior Training Services , an Indianapolis-based career-school chain , showed $ 24 million in defaults , or 44 % of the money lent to its students , in a state governments ' study .",literal,L
lend,"The Federal Home Loan Bank Board , as expected , adopted a resolution intended to reassure Wall Street firms that have lent about $ 12.6 billion to the thrift unit of troubled Financial Corp. of America .",literal,L
lend,"Mexico wants to be able to borrow from international banks again , and retiring its bank debt at about 70 cents on the dollar may discourage many banks from lending it more money , bankers said .",literal,L
lend,"The Department of Labor has stirred up a storm of controversy with proposed regulations that would govern how qualified pension plans , including 401 -LRB- k -RRB- savings arrangements , could lend money to participating employees .",literal,L
lend,"Federal regulators are expected to issue a statement as early as this week intended to reassure nervous Wall Street firms who have lent more than $ 10 billion to the thrift unit of deeply troubled Financial Corp. of America , Wall Street executives said .",literal,L
lend,Regulators are expected to issue soon a statement to reassure firms that have lent to the thrift unit of troubled Financial Corp. of America .,literal,L
lend,"So if he wants to return the federal money , his only option seems to be to find a friendly banker who will lend him the $ 6 million without collateral , on the strength of his predicted future receipts and his prodigious reputation for raising money when he was in the television religion business .",literal,L
lend,"Under the new agreements , LivingWell will lend T.H.E. about $ 1.2 million on a secured basis , cancel prior T.H.E. indebtedness to a LivingWell unit , and return about two million T.H.E. common shares .",literal,L
lend,"For example , he predicts that banks will lower their prime , or base , lending rate , which now is 8 1 2 % , to 8 % by midyear and 7 1 2 % by the end of the year .",literal,L
lend,"The proposal , a pet project of the Office of Management and Budget , would n't have any direct effect on the amount of money the government lends or on the budget deficit .",literal,L
lend,"That got the IDB 's attention , but we now wonder about the administration 's strategy for winning a greater say in where and to whom the IDB lends money .",literal,L
lend,"The IDB has lent more than $ 35 billion since its inception 27 years ago , much of it to create the type of parastatal companies Treasury Secretary James Baker has been trying to persuade Latin governments to dismantle .",literal,L
lend,"Nikko 's Mr. Axilrod predicts the central bank will try to hold the interest rate on federal funds -- the closely watched rate on reserves that banks lend each other overnight -- at about 6 1 2 % , down from the 6 3 4 % rate in recent weeks .",literal,L
lend,"Rates on short-term Treasury bills wound up little changed , but the rate on federal funds , or reserves that banks lend each other overnight , fell .",literal,L
lend,"They will change their attitude -- and will lend money to Brazil -- they have too much at stake not to , '' says Rimmer de Vries , chief international economist at Morgan Guaranty Trust Co .",literal,L
lend,"By January 1993 , societies would be able to lend 25 % of their assets for such nontraditional purposes as commercial property development and unsecured personal loans .",literal,L
lend,"He said banks soon may lower their prime , or base , lending rates , now 8 3 4 % .",literal,L
lend,"Banks have lent small amounts of gold for decades to borrowers such as jewelers , who use gold in their business .",literal,L
lend,Standard Chartered sought the investigation last February following press speculation that the bank illegally lent money to buyers of its shares to ward off Lloyds 's # 1.27 billion -LRB- $ 2.25 billion -RRB- bid .,literal,L
lend,"Mr. Muth is president of Real Estate Advisors Inc . , a Los Angeles investment management firm that agreed to lend Wespac as much as $ 1.5 million under the agreement .",literal,L
lend,"The final portion of that loan totals $ 1.2 billion , bankers said , adding that they are legally bound to lend the money .",literal,L
lend,"Alan Greenspan , chairman of the Federal Reserve Board , warned bankers about lending too much for leveraged buy-outs and other takeovers .",literal,L
lend,"Mr. Cohen , who is taking an active interest in the RJR deal because of the estimated $ 4 billion that Shearson would lend RJR , pleaded with Mr. Kravis not to become involved , according to these people .",literal,L
lend,"Early last year , the Navy lent two of the planes to the Coast Guard , and two to Customs .",literal,L
lend,"Since then , the World Bank alone has lent more than $ 83 billion to already overburdened Third World debtors .",literal,L
lend,"The real estate division , which reports to Mr. Brown , has also lost seasoned leadership at a time when it has been aggressively lending to developers .",literal,L
lend,"NCNB has been losing market share in its most important market , Florida , and it has ever slimmer profit margins from lending to some of its important big-businesses customers .",literal,L
lend,It was financed in part by lending from foreign banks flush with petrodollars .,literal,L
lend,"The FBI immediately lent Mr. Pelleu $ 3 , 800 , and arranged to tape several phone conversations he had with Mr. Sanders about the ring .",literal,L
lend,"The campaign was able to buy television time in the week before the election only because Mr. Ward personally lent it $ 20 , 000 .",literal,L
lend,"We lend him a stately and beautiful home and permit him to live on its topmost floor , attended by servants .",literal,L
lend,"This is one developing nation where U.S. banks have n't been left holding the bag , as under U.S. regulations they are n't allowed to lend to North Korea .",literal,L
lend,"Mr. Parkin says that in 1982 , he lent $ 13 , 000 to Mr. Cohen , the Air Force official responsible for tactical air systems and a close friend of Mr. Galvin .",literal,L
lend,"This year , it gave General Motors permission to lend -- through local dealerships -- fleets of cars for party VIPs to use during each convention .",literal,L
lend,"A major part of the sale proceeds will be used to repay about US $ 225 million in National Bank debt owed to the Brunei government and more than 40 international creditors , mainly banks that lent to National Bank before it was seized and closed by Brunei in November 1986 .",literal,L
lend,"A further $ 150 million in bank loans , the last slice of a $ 1.95 billion bank loan agreed on last year and linked to those IMF loans , also probably wo n't be lent now , compounding Argentina 's payments difficulties .",literal,L
lend,"The Canadian government agency said the funds will be lent to the Bank of China , which will make them available to the China National Technical Import & Export Corp . , which is purchasing the plants .",literal,L
lend,"The Atlanta-based company lent Ironton Iron $ 500 , 000 and has an option to buy it .",literal,L
lend,"Yet in Arkansas , lending to small local businesses is the bank 's primary mission .",literal,L
lend,Deutsche Bank is establishing a consortium to lend another $ 2.1 billion to the Soviets and doing what it can to prepare the way for a large Soviet issue of deutsche mark bonds .,literal,L
lend,"About US $ 75 million of the debt is owed to the Brunei government , with the remainder due more than 30 international banks that lent the then Khoo-owned National Bank money before it was seized and closed by Brunei in November 1986 .",literal,L
lend,"Particularly interesting are the pictures from Soviet museums , which have not previously lent to Gauguin retrospectives , nor have these conservative and understaffed institutions slathered varnish all over Gauguin 's colors , unlike many first-world owners .",literal,L
lend,Connecticut 's state pension plan has lent $ 475 million since 1981 for in-state mortgages .,literal,L
lend,"More recently , Pablo Casals 's widow lent him her husband 's precious Goffriller cello for two years and the teen-ager played chamber music at Carnegie Hall with Isaac Stern , Yo-Yo Ma and other luminaries .",literal,L
melt,"But the judge 's opinion said that the agitator for the vacuum cleaner `` was melting '' and `` making a loud noise , the foot pedal handle release was breaking and the vacuums were not equipped with a steel-encased motor as had been advertised to the trade , but rather with a less desirable and less reliable '' motor .",metaphorical,L
melt,"In Mr. Kupfer 's `` Ring , '' a nuclear war has melted most of the world and made shopping difficult .",metaphorical,L
melt,"The SEC suit alleges that the stock , which was unregistered , climbed to as high as $ 17 a share as a result of the claims , which were bolstered when Mr. Brown bought 209 ounces of gold , which was melted into four pieces and displayed to shareholders at an August 1987 meeting .",metaphorical,L
melt,"Engineers at General Binding , in Northbrook , Ill . , devised a method that melts the adhesive by sending a low-voltage current into the cover itself , resulting in a smaller and less expensive unit .",metaphorical,L
melt,"And now that the winter snows are melting along the Indo-Chinese border in the Himalayas , tension between the two Asian rivals is again rising .",metaphorical,L
melt,"More troubling to voters in Sacramento , perhaps , is that Babcock & Wilcox also designed the Three Mile Island unit that almost melted down in 1979 .",metaphorical,L
melt,Atlantic currently has melting and casting operations at both sites .,metaphorical,L
melt,"Mr. Martineau also says the tractors reflect another Russian approach to manufacturing: `` You could melt down one Belarus and make three American tractors with the amount of metal the Russians have put in it , '' he says .",metaphorical,L
melt,"It held open houses for prospective investors at the mine , where large amounts of rock were dug and ground up , filtered and washed , then melted in a furnace and `` poured into what were represented to be precious-metal blocks , shaped like pyramids , '' according to the criminal indictment filed against Mr. Barbara and four others in state court in Las Cruces , N.M .",metaphorical,L
melt,"But mindful of Daedalus 's brash son , Icarus , who flew too close to the sun , melted his wings and fell fatally to the sea , they carefully avoid hubris .",metaphorical,L
melt,"Chaparral is a mini-mill only in the sense that it melts scrap in electric furnaces , a type of operation that has made steady headway in the U.S. as the huge facilities that employ coke and iron ore and the traditional blast furnaces have declined .",metaphorical,L
melt,The villagers -LRB- using dynamite purchased with His Highness 's money -RRB- channeled melting mountain snow -- the only water available in this high desert -- to previously arid land .,metaphorical,L
melt,"There were kimono-clad waitresses , a couple of hundred men in blue suits , name cards , whiskey , little sushi bars and noodle stands along the walls , chefs with puff hats , piles of shrimp and meat , and an ice sculpture , slowly melting , as a centerpiece .",literal,L
melt,"The plant in Osuka , about 150 miles southwest of Tokyo , will finish glass melted in Corning , N.Y . , but melt facilities may be added later , the company said .",literal,L
melt,"Thanks to a new formula and colder dispensing equipment , Twistee Treat Corp. says its cones can be held for 12 minutes before starting to melt , twice as long as other brands .",literal,L
melt,"The fires , Ford said , could be caused by a nylon wiring shield that could melt and drip onto the engine 's hot exhaust manifold , `` resulting in an engine compartment fire . ''",literal,L
melt,"`` We had to melt it down with hot water , as hot as your head could stand , before we could comb the hair out , '' recalls Jennie Aguilar , a beauty-school instructor in Canoga Park , Calif .",literal,L
melt,Mr. Phillips said the bars would `` melt for about half '' of their auction price .,literal,L
melt,"Unable to buy gold , he bought jewelry items cheap at government retail stores , melted them down and fashioned them into stylish items sold at a markup on the black market .",literal,L
melt,"In a joint venture with a Japanese company this fall , Nucor Corp. of Charlotte will start melting steel in a new 500-worker I-beam mill at Blytheville , Ark . , on the Mississippi .",literal,L
melt,"Great ; when they 've finished melting , we 'll all have stew .",literal,L
