Judge1,Judge2,Judge3,Judge4,Judge5,subject,verb,object,sentence
0,0,0,0,0,stranger,approach,,She hated strangers approaching her for any reason.
0,0,0,0,0,smoke,arise,,The camp smoke arose from the usual places as far as I could see.
0,0,0,0,0,bus,arrive,,The bus eventually arrived.
0,0,0,0,0,,attach,hose,Attach a drain hose to the radiator drain.
0,0,0,0,0,pirate,attack,ship,Somali pirates have attacked 62 ships.
0,0,0,0,0,,beat,egg,"In a large bowl, beat eggs until foamy."
0,0,0,0,0,bomber,blow,vehicle,A suicide bomber blew up his sport-utility vehicle in the middle of a village volleyball game.
0,0,0,0,1,car,break,,"Amidst all of that commotion, my wife's car broke down while she was out getting us pizza."
0,0,0,0,0,son,break,window,Her son broke my window.
0,0,0,0,0,,bring,food,It is imperative that you bring your own food.
0,0,1,0,0,candle,burn,,I love that these candles burn clean!
0,0,0,0,0,firework,burst,,Fireworks burst over the stadium and lit the night sky.
0,0,0,0,0,army,bury,soldier,The Army started burying soldiers along the northern border of the Arlington estate.
0,0,0,0,0,ship,carry,passenger,Ships typically carry up to 12 passengers in comfortable single or double cabins.
0,0,0,0,0,,catch,salmon,"We each caught another salmon that day, too."
0,0,0,0,0,,clean,stain,"Clean a carpet stain immediately, even if you can't see it."
0,0,0,0,0,,climb,stairs,They climb the stairs to the top of the dam
0,0,0,0,0,police,close,road,The police closed the main exit road.
0,0,0,0,0,Jim,close,book,Jim closed the book.
0,0,0,0,0,bridge,collapse,,A bridge had collapsed due to the rains.
0,0,0,0,0,reviewer,complain,,Some reviewers have complained about the smell.
0,0,0,0,0,boy,cry,,By this time the young boy was crying.
0,0,0,0,0,,cut,grass,I used to cut grass on a golf course when I was in college.
0,0,0,0,0,judge,decide,,The judges decide on the winner of the category.
0,0,0,0,0,protester,demand,,The protesters demanded the release of the jailed students.
0,0,0,0,0,father,die,,Her father died when she was very young.
0,0,0,0,0,workman,dig,pond,I found them while the workmen were digging this pond.
0,0,0,0,0,,drag,suitcase,He dragged his suitcase up the stairs of the inn.
0,0,0,0,0,bride,dream,,Some brides dream of an elegant formal ceremony in a huge castle.
0,0,0,0,0,camel,drink,water,Most informants agreed that camels drink more water in the winter than in the summer.
0,0,1,0,0,driver,drive,,The driver was driving on the wrong side of the road and did not see Joshua.
0,0,0,0,0,paint,dry,,This paint dries fast!
0,0,0,0,0,,eat,breakfast,If you don't eat breakfast and you're tired by 9 am.
0,0,0,0,0,visitor,enter,room,Passing through the hallway visitors enter into the dining room.
0,0,0,0,0,prisoner,escape,," A couple of prisoners have escaped from the jail near Reykjavik, Iceland. "
0,0,0,0,0,leaf,fall,,All the leaves had fallen from the trees.
0,0,0,0,0,,feed,cow,The farmer arrived to feed the cows.
0,0,0,0,0,,fill,bottle,You will be able to fill the water bottle at a fountain.
0,0,0,0,0,lava,flow,,Yesterday lava flowed 90 meters wide as far out as a hundred meters from the shoreline.
0,0,0,0,0,plane,fly,,"Contra planes flew north to the U.S., loaded with cocaine."
0,0,0,0,0,man,go,city,A man went to a city.
0,0,0,0,0,,grab,towel,She grabbed a towel and wrapped it around her head.
0,0,0,0,0,,grow,vegetables,"And then my dad had a garden, so he grew vegetables."
0,0,0,0,0,,hand,key,A week later we handed the keys to our old apartment to our landlord.
0,0,0,0,0,head,hit,ground,I remember my head hit the ground.
0,0,0,0,0,stomach,hurt,,As soon as I lie down my stomach hurts again.
0,0,0,0,1,fish,jump,,Now the fish are jumping out of the pond right into my net!
0,0,0,0,0,kicker,kick,football,"To score this point, a kicker must kick the football through the goal posts."
0,0,0,0,1,bomber,kill,person,"In July, a suicide bomber killed three people including the top justice official in the region."
0,0,0,0,1,salesman,knock,door,How do you feel when a salesman knocks at your door when you're hurriedly getting ready for the office?
0,0,0,0,0,helicopter,land,,The helicopter landed in the snow.
0,0,0,0,0,Iran,launch,satellite,Iran plans to launch an additional satellite.
0,0,0,0,1,couple,lay,wreath,The couple laid a wreath at the Tomb of the Unknown Soldier.
0,0,0,0,0,,lean,head,"I shouted to the driver, who was leaning his head out the window."
0,0,0,0,0,pharmacist,lean,,The pharmacist leaned forward and said he understood.
0,0,0,0,0,,lift,leg,These muscles are used to help lift your legs.
0,0,0,0,1,child,live,,"If my children lived nearby, I would be babysitting."
0,0,0,0,0,person,love,,People love to be asked about what they're working on.
0,0,0,0,0,daughter,marry,man,My daughter has married an Indian man and we attended the traditional Hindu wedding.
0,0,0,0,0,,meet,girl,I met a girl who claimed she was in the circus.
0,0,0,0,0,object,move,,The object then moved slowly away.
0,0,1,0,0,man,nod,approval,The man nodded his approval and walked around to me.
0,0,0,0,1,Miranda,open,mouth,"Miranda opened her mouth to reply, but no words came out."
0,0,0,0,0,antena,point,,Note that the antennas are pointing in different directions.
0,0,0,0,0,horse,pull,head,The horse pulled his head away and lipped the man's nose.
0,0,0,0,0,steam,push,piston,The steam pushed the piston up and down.
0,0,0,0,0,student,raise,hand,"At Pitzer College on Wednesday night, nearly 150 students raised their hands."
0,0,0,0,0,landlord,refuse,,What can you do if the landlord refuses to make repairs to the premises?
0,0,0,0,0,cowboy,ride,,A pair of cowboys rode into town.
0,0,0,0,1,column,rise,,Columns of smoke rose from fires burning out of control.
0,0,0,0,1,tear,roll,,The tears rolled down the poor child's face.
0,0,0,0,0,horse,run,,I rarely have a chance to see my horses run.
0,0,0,0,0,reporter,rush,,Reporters rushed to the scene.
0,0,0,0,0,doctor,say,,The doctor said it would heal fine that way.
0,0,0,0,0,crowd,scream,,The crowd screamed and sang along as usual.
0,0,0,0,0,immigrant,settle,Hawaii,Hawaii of course was settled by Polynesian immigrants from Tahiti about one thousand years ago.
0,0,0,0,0,man,shake,head,The young man shook his head.
0,0,0,0,0,,shrug,shoulder,He just shrugged his shoulders.
0,0,0,0,0,submarine,sink,ship,The ship was sunk by a Soviet submarine.
0,0,1,0,0,cat,sit,,His cat was now sitting expectantly upon his feet.
0,0,0,0,0,baby,sleep,,Most babies sleep primarily in their parent's room for months.
0,0,0,0,1,drawer,slide,,The top right-hand drawer slid open at a touch.
0,0,0,0,0,foot,slip,,Theo's foot slipped on the slick stone.
0,0,0,0,0,Dean,slip,knife,Dean slips his own knife into the sheath in the back of his pants
0,0,0,0,0,Frodo,smile,,Frodo smiled amid his tears.
0,0,0,0,0,,spread,glue,Use a small brush to spread glue on the egg.
0,0,0,0,0,statue,stand,,"For a while, the headless statue stood in the front yard of a neighboring home."
0,0,0,0,0,Frodo,stare,,Frodo stared at the stone in his palm for a few moments.
0,0,0,0,0,thief,steal,photo,The thief stole the photo from the museum in Prague.
0,1,1,0,0,engineer,steal,secret,The engineer stole Boeing trade secrets.
0,0,0,0,0,Blair,step,,Blair stepped out of the car to meet him.
0,0,0,0,0,Beth,stick,tongue,Beth turned her head and stuck her tongue at me.
0,0,0,0,0,Frank,stretch,arm,Frank stretched his arm out across the length of the back of the bench.
0,0,0,0,0,woman,suffer,pain,Some women suffer no pain at all.
0,0,0,0,0,bar,support,weight,The bar supports the full weight of the person.
0,0,0,0,0,human,survive,,Can humans survive without water?
0,0,0,0,0,man,sweep,floor,The old man was sweeping the floor.
0,0,0,0,0,shark,swim,,There were over a dozen whale sharks swimming around us.
0,0,0,0,0,politician,talk,,Have you ever seen a politician talking to a rich person on TV?
0,0,0,0,0,patient,tear,cuff,Older patients may tear the rotator cuff during the dislocation.
0,0,1,0,0,scientist,think,,"Scientists think they have discovered the first liquid sea outside of Earth on Saturn's largest moon, Titan."
0,0,0,0,0,Lebanese,throw,rock,Lebanese throw rocks at Israeli soldiers.
0,0,0,0,0,,tie,ribbon,Then you can also tie a ribbon around the card to make it look pretty.
0,0,0,0,0,ladder,touch,ground,The longer of the two ladders is not touching the ground.
0,0,0,0,0,passenger,travel,,"All passengers travel in cabins, and all cabins have a private shower & toilet."
0,0,1,0,0,Jim,turn,,Jim turned and walked into the waiting room.
0,0,0,0,1,thunder,wake,,"One morning at daybreak, thunder woke him. "
0,0,0,0,0,Misha,walk,dog,Misha walks his dogs in the park.
0,0,0,0,0,pedestrian,walk,,Pedestrians walk between cafes and other small businesses.
0,0,0,0,0,,wear,helmet,We always wear helmets when we are riding bikes.
0,0,0,0,0,volunteer,welcome,visitor,Today volunteers welcome visitors and groups of all sizes.